{
  "calculation_strategy": "lut",
  "created_at": "2026-04-17T17:03:41Z",
  "device_type": "light",
  "measure_description": "Measured with utils/measure script",
  "measure_device": "IKEA INSPELNING smart plug",
  "measure_method": "script",
  "measure_settings": {
    "SAMPLE_COUNT": 2,
    "SLEEP_TIME": 5,
    "VERSION": "v1.20.12:docker"
  },
  "name": "Mijia Philips Desk Lamp 3",
  "standby_power": 0.4
}